{
    "keyword": "consultant professional liability insurance",
    "primary_intent": "Informational",
    "secondary_intent": null,
    "confidence": 1.0,
    "scores": {
        "Informational": 1
    },
    "signals": {
        "Informational": [
            "no-explicit-intent-signal"
        ]
    }
}